{
  "$schema": "https://json-schema.org/draft/2020-12/schema",
  "title": "AcceptedArtworkImport",
  "type": "object",
  "additionalProperties": false,
  "required": [
    "schema_version",
    "kind",
    "status",
    "authorization",
    "adapter_version",
    "input_hashes",
    "pages",
    "created_at"
  ],
  "properties": {
    "schema_version": {
      "const": "1.0"
    },
    "kind": {
      "const": "accepted_artwork_import"
    },
    "status": {
      "const": "completed"
    },
    "authorization": {
      "type": "object",
      "additionalProperties": false,
      "required": [
        "path",
        "sha256"
      ],
      "properties": {
        "path": {
          "type": "string",
          "minLength": 1
        },
        "sha256": {
          "type": "string",
          "pattern": "^[a-f0-9]{64}$"
        }
      }
    },
    "adapter_version": {
      "type": "string",
      "minLength": 1
    },
    "input_hashes": {
      "type": "object",
      "minProperties": 9,
      "additionalProperties": {
        "type": "string",
        "pattern": "^[a-f0-9]{64}$"
      }
    },
    "pages": {
      "type": "array",
      "minItems": 1,
      "maxItems": 18,
      "items": {
        "type": "object",
        "additionalProperties": false,
        "required": [
          "page_id",
          "source_page_id",
          "selected_case",
          "selection_mode",
          "selection_approval",
          "artifacts",
          "proof"
        ],
        "properties": {
          "page_id": {
            "type": "string",
            "minLength": 1
          },
          "source_page_id": {
            "type": "string",
            "pattern": "^edp_"
          },
          "selected_case": {
            "enum": [
              "A",
              "B",
              "C"
            ]
          },
          "selection_mode": {
            "enum": [
              "accepted_selected_variant",
              "authorized_single_case"
            ]
          },
          "selection_approval": {
            "type": "object",
            "additionalProperties": false,
            "required": [
              "path",
              "sha256"
            ],
            "properties": {
              "path": {
                "type": "string",
                "minLength": 1
              },
              "sha256": {
                "type": "string",
                "pattern": "^[a-f0-9]{64}$"
              }
            }
          },
          "single_case_authorization": {
            "type": "object",
            "additionalProperties": false,
            "required": [
              "path",
              "sha256"
            ],
            "properties": {
              "path": {
                "type": "string",
                "minLength": 1
              },
              "sha256": {
                "type": "string",
                "pattern": "^[a-f0-9]{64}$"
              }
            }
          },
          "artifacts": {
            "type": "object",
            "additionalProperties": false,
            "required": [
              "scene",
              "png",
              "phone",
              "gray"
            ],
            "properties": {
              "scene": {
                "type": "object",
                "additionalProperties": false,
                "required": [
                  "path",
                  "sha256"
                ],
                "properties": {
                  "path": {
                    "type": "string",
                    "minLength": 1
                  },
                  "sha256": {
                    "type": "string",
                    "pattern": "^[a-f0-9]{64}$"
                  }
                }
              },
              "png": {
                "type": "object",
                "additionalProperties": false,
                "required": [
                  "path",
                  "sha256"
                ],
                "properties": {
                  "path": {
                    "type": "string",
                    "minLength": 1
                  },
                  "sha256": {
                    "type": "string",
                    "pattern": "^[a-f0-9]{64}$"
                  }
                }
              },
              "phone": {
                "type": "object",
                "additionalProperties": false,
                "required": [
                  "path",
                  "sha256"
                ],
                "properties": {
                  "path": {
                    "type": "string",
                    "minLength": 1
                  },
                  "sha256": {
                    "type": "string",
                    "pattern": "^[a-f0-9]{64}$"
                  }
                }
              },
              "gray": {
                "type": "object",
                "additionalProperties": false,
                "required": [
                  "path",
                  "sha256"
                ],
                "properties": {
                  "path": {
                    "type": "string",
                    "minLength": 1
                  },
                  "sha256": {
                    "type": "string",
                    "pattern": "^[a-f0-9]{64}$"
                  }
                }
              }
            }
          },
          "proof": {
            "type": "object",
            "additionalProperties": false,
            "required": [
              "gate",
              "manifest",
              "review",
              "approval"
            ],
            "properties": {
              "gate": {
                "type": "object",
                "additionalProperties": false,
                "required": [
                  "path",
                  "sha256"
                ],
                "properties": {
                  "path": {
                    "type": "string",
                    "minLength": 1
                  },
                  "sha256": {
                    "type": "string",
                    "pattern": "^[a-f0-9]{64}$"
                  }
                }
              },
              "manifest": {
                "type": "object",
                "additionalProperties": false,
                "required": [
                  "path",
                  "sha256"
                ],
                "properties": {
                  "path": {
                    "type": "string",
                    "minLength": 1
                  },
                  "sha256": {
                    "type": "string",
                    "pattern": "^[a-f0-9]{64}$"
                  }
                }
              },
              "review": {
                "type": "object",
                "additionalProperties": false,
                "required": [
                  "path",
                  "sha256"
                ],
                "properties": {
                  "path": {
                    "type": "string",
                    "minLength": 1
                  },
                  "sha256": {
                    "type": "string",
                    "pattern": "^[a-f0-9]{64}$"
                  }
                }
              },
              "approval": {
                "type": "object",
                "additionalProperties": false,
                "required": [
                  "path",
                  "sha256"
                ],
                "properties": {
                  "path": {
                    "type": "string",
                    "minLength": 1
                  },
                  "sha256": {
                    "type": "string",
                    "pattern": "^[a-f0-9]{64}$"
                  }
                }
              }
            }
          }
        }
      }
    },
    "editor_review": {
      "type": "object",
      "additionalProperties": false,
      "required": [
        "path",
        "sha256"
      ],
      "properties": {
        "path": {
          "type": "string",
          "minLength": 1
        },
        "sha256": {
          "type": "string",
          "pattern": "^[a-f0-9]{64}$"
        }
      }
    },
    "created_at": {
      "type": "string",
      "format": "date-time"
    }
  }
}
