{
  "schema_version": "1.0",
  "kind": "accepted_artwork_import",
  "status": "completed",
  "authorization": {
    "path": "[本地工作区]/outputs/GitHub开源发布收尾-2026-10-07/latest-EP59/IMPORT_AUTHORIZATION.json",
    "sha256": "92e3987d596f7547410e4003eb22a1eb10f53dd772aa47a99de60099c003541c"
  },
  "adapter_version": "0.18.1",
  "input_hashes": {
    "episode_metadata": "baa346fd1ca2c2f07aa5d5c53685865ab4341b5c1ad8e2235648fce60a4fa636",
    "content_review_gate": "331d8c80ad247f8bd26e9159100adc6ea2d8bc6595347f610eb01ea62135d57d",
    "content_split_gate": "e65191080a4eb463ba3f0bfdcd371236d9469c6b87c261e8dfe3a54b6d4c33b7",
    "knowledge_graph": "ea0808e1e69950caf19e36b178480a2361008086c3b94592b8c2dfdd8e605751",
    "knowledge_gate": "d2183d0b16f3c352cfd3453eeba1d6f96192b779eb5bfa52093dbbee5f2a6286",
    "editorial_plan": "f3fa934f160eba7ffcc18f73257bc1d3668ce53aeb819e4aee99d27aad62249f",
    "editorial_gate": "47c00151e4ee6a5922d5d1e0faf296a66c415f2a0ddb855339c30332789928ac",
    "coverage_matrix": "9319674e606fb45154917494eec30de0eeed2cea994e7e1156a115945e01806f",
    "design_tokens": "92c3026483d1e8d50145895f380e614f8b5aeb8156c96e4132377c4122994474"
  },
  "pages": [
    {
      "page_id": "P00",
      "source_page_id": "edp_cover_6ab61d4b195d838e2ae9fc1e",
      "selected_case": "A",
      "selection_mode": "accepted_selected_variant",
      "selection_approval": {
        "path": "[本地工作区]/outputs/github-release-slim-review-2026-10-01/e2e-6ab61d4b195d838e2ae9fc1e/02-visual-plan/P00-cover-three-choice-2026-10-04/PAGE_VARIANT_SELECTION.json",
        "sha256": "46d9663b44a46622cf3d78992be37702e49e3fb9760b684e47210de87bc05330"
      },
      "artifacts": {
        "scene": {
          "path": "03-excalidraw/P00.excalidraw",
          "sha256": "52891194e46d22621d0f26b31db88abfc3f0277d962107c180b2ed45d05bc943"
        },
        "png": {
          "path": "04-rendered/P00.png",
          "sha256": "99bdf2c43f73d6cb2529594dba66eb49de5406f248201a4a74a3e1e5eb8a692d"
        },
        "phone": {
          "path": "04-rendered/P00-phone.png",
          "sha256": "6fb59d77364029d65aeb8f1ec45e87c4c04f6f7c01b7fb4e94ea6e5c73068127"
        },
        "gray": {
          "path": "04-rendered/P00-gray.png",
          "sha256": "16d6edbd5c130be7b73405863d9c029e350731b92489ac1476ef6f3f03f78020"
        }
      },
      "proof": {
        "gate": {
          "path": "[本地工作区]/outputs/EP59-交付待办逐项确认-2026-10-06/正式缺口修复-2026-10-06/current-review-inputs/P00/closeout-workspace/04-rendered/render_gate.json",
          "sha256": "8527ce618179e88c36a100119403a94939d4ad279060bdf8e83a8a97ac776027"
        },
        "manifest": {
          "path": "[本地工作区]/outputs/EP59-交付待办逐项确认-2026-10-06/正式缺口修复-2026-10-06/current-review-inputs/P00/closeout-workspace/04-rendered/render_manifest.json",
          "sha256": "e6ea7fe69295f1a2087639a1d8465632d5f07caf6b4d40fdf33f04dce7ff419f"
        },
        "review": {
          "path": "[本地工作区]/outputs/EP59-交付待办逐项确认-2026-10-06/正式缺口修复-2026-10-06/current-review-inputs/P00/closeout-workspace/04-rendered/independent_visual_review.json",
          "sha256": "664cd8dd27757d351ae31f725b2376a0cc647c4365aa145b952203c46a9dfad5"
        },
        "approval": {
          "path": "[本地工作区]/outputs/EP59-交付待办逐项确认-2026-10-06/正式缺口修复-2026-10-06/current-review-inputs/P00/closeout-workspace/04-rendered/visual_page_human_approval.json",
          "sha256": "bd3161f6b26cb27df24848ad3b6db43f3b6586f318101fa862d4751c4a1f6e1e"
        }
      }
    },
    {
      "page_id": "P01",
      "source_page_id": "edp_overview_6ab61d4b195d838e2ae9fc1e",
      "selected_case": "C",
      "selection_mode": "accepted_selected_variant",
      "selection_approval": {
        "path": "[本地工作区]/outputs/EP59-三页设计重构-2026-10-06/P01/PAGE_VARIANT_SELECTION.json",
        "sha256": "7f35c5de114ed875ea81941eb31cb164a26620460e35a7b779f319b97de27896"
      },
      "artifacts": {
        "scene": {
          "path": "03-excalidraw/P01.excalidraw",
          "sha256": "c32569a4e3c9d2142cf82d61a49d214759df004a32fde4ba0c57752b8455d0ee"
        },
        "png": {
          "path": "04-rendered/P01.png",
          "sha256": "53cd62848b1a2a42680958464868f4967631f66eb79cd2e8751a381a07086774"
        },
        "phone": {
          "path": "04-rendered/P01-phone.png",
          "sha256": "d2fd8caa68a202d13ee87280b4e87db10626ef7d91f9def7d77967c662408705"
        },
        "gray": {
          "path": "04-rendered/P01-gray.png",
          "sha256": "d9ab59d467324f9f9d44bd17f3abb8ecddf349824853257c2a88787514d62874"
        }
      },
      "proof": {
        "gate": {
          "path": "[本地工作区]/outputs/EP59-三页设计重构-2026-10-06/P01/full-C-v1/review-workspace/04-rendered/render_gate.json",
          "sha256": "42366cbbb3cadcecd67bc16cb8bef1188ac8af7513088520dc4bf51c69023720"
        },
        "manifest": {
          "path": "[本地工作区]/outputs/EP59-三页设计重构-2026-10-06/P01/full-C-v1/review-workspace/04-rendered/render_manifest.json",
          "sha256": "91f92980c9f580fc49377f51988ead1df35a18928a046905a040e9e6627a37ed"
        },
        "review": {
          "path": "[本地工作区]/outputs/EP59-三页设计重构-2026-10-06/P01/full-C-v1/review-workspace/04-rendered/independent_visual_review.json",
          "sha256": "917deae0d64e9e3d4f0b0abb95f1e48d03ea6cef69bba08fba8bb94c6d7f2a55"
        },
        "approval": {
          "path": "[本地工作区]/outputs/EP59-三页设计重构-2026-10-06/P01/full-C-v1/review-workspace/04-rendered/visual_page_human_approval.json",
          "sha256": "2888be9096df8bac13951fd93e219f87a10e6c42d6336c904aab8cfd3b2e0d68"
        }
      }
    },
    {
      "page_id": "P02",
      "source_page_id": "edp_dd_6ab61d4b195d838e2ae9fc1e_p02",
      "selected_case": "B",
      "selection_mode": "accepted_selected_variant",
      "selection_approval": {
        "path": "[本地工作区]/outputs/EP59-交付待办逐项确认-2026-10-06/P02/USER_FINAL_SELECTION_B.json",
        "sha256": "13fb304cb41da4f4482247b53586d31339a9adb7c562ad75cab24250a2f6a0f8"
      },
      "artifacts": {
        "scene": {
          "path": "03-excalidraw/P02.excalidraw",
          "sha256": "120c7c16b7eb587a042a08d193fac7551d0d9c6e37f7ae4e8fcd8c7bf44ed1e1"
        },
        "png": {
          "path": "04-rendered/P02.png",
          "sha256": "11356fa9d1c312918ea8c460d34b124258331af0fadb114a96a26e72b8f62d76"
        },
        "phone": {
          "path": "04-rendered/P02-phone.png",
          "sha256": "7b5e07e2ba71112e8d69480277ad48b99f96f39aac44f7769b09e283798d412d"
        },
        "gray": {
          "path": "04-rendered/P02-gray.png",
          "sha256": "13889eec56c41a8a28edacc2dc3d1176bbd5b60fcfeaef94210173f4c8fc48d4"
        }
      },
      "proof": {
        "gate": {
          "path": "[本地工作区]/outputs/EP59-交付待办逐项确认-2026-10-06/正式缺口修复-2026-10-06/current-review-inputs/P02/closeout-workspace/04-rendered/render_gate.json",
          "sha256": "697f0ea729e0c3c23dfd5e4bca799f1db786037d9835997dec1919ebc643dd5d"
        },
        "manifest": {
          "path": "[本地工作区]/outputs/EP59-交付待办逐项确认-2026-10-06/正式缺口修复-2026-10-06/current-review-inputs/P02/closeout-workspace/04-rendered/render_manifest.json",
          "sha256": "8bca43c02b3f7939d2da61a558a49a25ec39a3d7c1b128b9f94055f0a71802d1"
        },
        "review": {
          "path": "[本地工作区]/outputs/EP59-交付待办逐项确认-2026-10-06/正式缺口修复-2026-10-06/current-review-inputs/P02/closeout-workspace/04-rendered/independent_visual_review.json",
          "sha256": "f73a67519e5a7f566543399e8fda432031a20a07e5cb31c64b5a81847e1d35fc"
        },
        "approval": {
          "path": "[本地工作区]/outputs/EP59-交付待办逐项确认-2026-10-06/正式缺口修复-2026-10-06/current-review-inputs/P02/closeout-workspace/04-rendered/visual_page_human_approval.json",
          "sha256": "d9b67218981b17c561077abd083622f64214448d36533162751f4d34b2a42a61"
        }
      }
    },
    {
      "page_id": "P03",
      "source_page_id": "edp_dd_6ab61d4b195d838e2ae9fc1e_p03",
      "selected_case": "C",
      "selection_mode": "accepted_selected_variant",
      "selection_approval": {
        "path": "[本地工作区]/outputs/EP59-交付待办逐项确认-2026-10-06/正式缺口修复-2026-10-06/USER_P03_P05_REPAIR_APPROVAL.json",
        "sha256": "e60fa8ec567c414e964c3d3759cdf0dfc16383613fb061c9ee97e02167495923"
      },
      "artifacts": {
        "scene": {
          "path": "03-excalidraw/P03.excalidraw",
          "sha256": "7093bfaa58d83271a47ff1f8ac21e6bca7edb5f937211ce2be93b4f8742706d0"
        },
        "png": {
          "path": "04-rendered/P03.png",
          "sha256": "906a816a2d931fba5271daca2d2107fe960c949eef18e29077f9acdafff335cc"
        },
        "phone": {
          "path": "04-rendered/P03-phone.png",
          "sha256": "fe130a9b09b56602e32a6df7dd3206b654c7f92f2ad9834a14c2710c2903e9ec"
        },
        "gray": {
          "path": "04-rendered/P03-gray.png",
          "sha256": "8361d018b6a5dca01e90ca605d805977767bcf76a0b1cf322e31cbd79d521d53"
        }
      },
      "proof": {
        "gate": {
          "path": "[本地工作区]/outputs/EP59-交付待办逐项确认-2026-10-06/正式缺口修复-2026-10-06/P03-scoped-repair-v1/review-workspace/04-rendered/render_gate.json",
          "sha256": "4dff5dc7ba65947e7a6412c60ec010e7d25c4a5b6e2edbcc3a16767be24a14f5"
        },
        "manifest": {
          "path": "[本地工作区]/outputs/EP59-交付待办逐项确认-2026-10-06/正式缺口修复-2026-10-06/P03-scoped-repair-v1/review-workspace/04-rendered/render_manifest.json",
          "sha256": "94a1c404e0007282379f0945cc6519ff47f7e60ed574872438577b0281213318"
        },
        "review": {
          "path": "[本地工作区]/outputs/EP59-交付待办逐项确认-2026-10-06/正式缺口修复-2026-10-06/P03-scoped-repair-v1/review-workspace/04-rendered/independent_visual_review.json",
          "sha256": "3bb8ff7aa715e35187c43e41ae3f4bbd608431692e36929a8b4b1887b631e4c3"
        },
        "approval": {
          "path": "[本地工作区]/outputs/EP59-交付待办逐项确认-2026-10-06/正式缺口修复-2026-10-06/P03-scoped-repair-v1/review-workspace/04-rendered/visual_page_human_approval.json",
          "sha256": "519eb83c1c98a72f76ce15f471bf74ccd846bd9693d7efe35c6652845f0e8c80"
        }